### ISSUE TITLE
Problema de conexão com banco de dados MySQL

### ISSUE THREAD

**Issue by VQFCOSTA-Infortech** [mRemoteNG/mRemoteNG#2465]
## Expected Behavior

A problem, I have communication with the database from the machine where mRemoteNG is, but mRemoteNG cannot connect to the database.

## Current Behavior

The current problem is that mRemoteNG doesn't even connect from the SQL server, it just reports an unknown error, but it doesn't even try to connect to the database.

## Possible Solution

I can't imagine how they can solve the problem

## Steps to Reproduce (for bugs)

1.
two.
3.
4.

## Context

I need to make the mRemoteNG connection work with the MySQL server to share the saved hits with my team.

## Your Environment

* Version used:
* Operating System and version (e.g. Windows 10 1709 x64):
Windows 10

**Comment by Kvarkas** [comment]
what version you are reffering? And please english, or russian or lithuanian only

**Comment by VQFCOSTA-Infortech** [comment]
--------------------------------------------------------------------------------------
RemoteNG 
Installed version: 1.76.20.24669
Current version: 1.76.11.40592

--------------------------------------------------------------------------------------
Server Ubuntu
Server version: 5.7.42-0ubuntu0.18.04.1-log (Ubuntu)

--------------------------------------------------------------------------------------
MySQL
mysql  Ver 14.14 Distrib 5.7.42, for Linux (x86_64) using  EditLine wrapper


--------------------------------------------------------------------------------------

SQL script installed in DB provided by mRemoteNG and tuned for MySQL on Linux
-- Delete tblCons table if exists
DROP TABLE IF EXISTS tblCons;

-- Delete tblRoot table if exists
DROP TABLE IF EXISTS tblRoot;

-- Delete tblUpdate table if it exists
DROP TABLE IF EXISTS tblUpdate;

-- Create table tblCons
CREATE TABLE tblCons (
     ID INT AUTO_INCREMENT PRIMARY KEY NOT NULL,
     ConstantID VARCHAR(128) NULL,
     PositionID INT NOT NULL,
     ParentID VARCHAR(128) NULL,
     LastChange DATETIME NOT NULL,
     Name VARCHAR(128) NOT NULL,
     Type VARCHAR(32) NOT NULL,
     Expanded BIT NOT NULL,
     Description VARCHAR(1024) NULL,
     Icon VARCHAR(128) NOT NULL,
     Panel VARCHAR(128) NOT NULL,
     Username VARCHAR(512) NULL,
     DomainName VARCHAR(512) NULL,
     Password VARCHAR(1024) NULL,
     Hostname VARCHAR(512) NULL,
     Protocol VARCHAR(32) NOT NULL,
     PuttySession VARCHAR(128) NULL,
     Port INT NOT NULL,
     ConnectToConsole BIT NOT NULL,
     UseCredSsp BIT NOT NULL,
     RenderingEngine VARCHAR(10) NULL,
     ICAEncryptionStrength VARCHAR(32) NOT NULL,
     RDPAuthenticationLevel VARCHAR(32) NOT NULL,
     RDPMinutesToIdleTimeout INT NOT NULL,
     RDPAlertIdleTimeout BIT NOT NULL,
     Colors VARCHAR(32) NOT NULL,
     Resolution VARCHAR(32) NOT NULL,
     DisplayWallpaper BIT NOT NULL,
     DisplayThemes BIT NOT NULL,
     EnableFontSmoothing BIT NOT NULL,
     EnableDesktopComposition BIT NOT NULL,
     CacheBitmaps BIT NOT NULL,
     RedirectDiskDrives BIT NOT NULL,
     RedirectPorts BIT NOT NULL,
     RedirectPrinters BIT NOT NULL,
     RedirectSmartCards BIT NOT NULL,
     RedirectSound VARCHAR(64) NOT NULL,
     SoundQuality VARCHAR(20) NOT NULL,
     RedirectKeys BIT NOT NULL,
     Connected BIT NOT NULL,
     PreExtApp VARCHAR(256) NULL,
     PostExtApp VARCHAR(256) NULL,
     MacAddress VARCHAR(32) NULL,
     UserField VARCHAR(256) NULL,
     ExtApp VARCHAR(256) NULL,
     VNCCompression VARCHAR(10) NULL,
     VNCEncoding VARCHAR(20) NULL,
     VNCAuthMode VARCHAR(10) NULL,
     VNCProxyType VARCHAR(20) NULL,
     VNCProxyIP VARCHAR(128) NULL,
     VNCProxyPort INT NULL,
     VNCProxyUsername VARCHAR(512) NULL,
     VNCProxyPassword VARCHAR(1024) NULL,
     VNCColors VARCHAR(10) NULL,
     VNCSmartSizeMode VARCHAR(20) NULL,
     VNCViewOnly BIT NOT NULL,
     RDGatewayUsageMethod VARCHAR(32) NOT NULL,
     RDGatewayHostname VARCHAR(512) NULL,
     RDGatewayUseConnectionCredentials VARCHAR(32) NOT NULL,
     RDGatewayUsername VARCHAR(512) NULL,
     RDGatewayPassword VARCHAR(1024) NULL,
     RDGatewayDomain VARCHAR(512) NULL,
     InheritCacheBitmaps BIT NOT NULL,
     InheritColors BIT NOT NULL,
     InheritDescription BIT NOT NULL,
     InheritDisplayThemes BIT NOT NULL,
     InheritDisplayWallpaper BIT NOT NULL,
     InheritEnableFontSmoothing BIT NOT NULL,
     InheritEnableDesktopComposition BIT NOT NULL,
     InheritDomain BIT NOT NULL,
     InheritIcon BIT NOT NULL,
     InheritPanel BIT NOT NULL,
     InheritPassword BIT NOT NULL,
     InheritPort BIT NOT NULL,
     InheritProtocol BIT NOT NULL,
     InheritPuttySession BIT NOT NULL,
     InheritRedirectDiskDrives BIT NOT NULL,
     InheritRedirectKeys BIT NOT NULL,
     InheritRedirectPorts BIT NOT NULL,
     InheritRedirectPrinters BIT NOT NULL,
     InheritRedirectSmartCards BIT NOT NULL,
     InheritRedirectSound BIT NOT NULL,
     InheritSoundQuality BIT NOT NULL,
     InheritResolution BIT NOT NULL,
     InheritUseConsoleSession BIT NOT NULL,
     InheritUseCredSsp BIT NOT NULL,
     InheritRenderingEngine BIT NOT NULL,
     InheritICAEncryptionStrength BIT NOT NULL,
     InheritRDPAuthenticationLevel BIT NOT NULL,
     InheritRDPMinutesToIdleTimeout BIT NOT NULL,
     InheritRDPAlertIdleTimeout BIT NOT NULL,
     InheritUsername BIT NOT NULL,
     InheritPreExtApp BIT NOT NULL,
     InheritPostExtApp BIT NOT NULL,
     InheritMacAddress BIT NOT NULL,
     InheritUserField BIT NOT NULL,
     InheritExtApp BIT NOT NULL,
     InheritVNCCompression BIT NOT NULL,
     InheritVNCEncoding BIT NOT NULL,
     InheritVNCAuthMode BIT NOT NULL,
     InheritVNCProxyType BIT NOT NULL,
     InheritVNCProxyIP BIT NOT NULL,
     InheritVNCProxyPort BIT NOT NULL,
     InheritVNCProxyUsername BIT NOT NULL,
     InheritVNCProxyPassword BIT NOT NULL,
     InheritVNCColors BIT NOT NULL,
     InheritVNCSmartSizeMode BIT NOT NULL,
     InheritVNCViewOnly BIT NOT NULL,
     InheritRDGatewayUsageMethod BIT NOT NULL,
     InheritRDGatewayHostname BIT NOT NULL,
     InheritRDGatewayUseConnectionCredentials BIT NOT NULL,
     InheritRDGatewayUsername BIT NOT NULL,
     InheritRDGatewayPassword BIT NOT NULL,
     InheritRDGatewayDomain BIT NOT NULL,
     LoadBalanceInfo VARCHAR(1024) NULL,
     AutomaticResize BIT NOT NULL DEFAULT 1,
     InheritLoadBalanceInfo BIT NOT NULL DEFAULT 0,
     InheritAutomaticResize BIT NOT NULL DEFAULT 0
) ENGINE=InnoDB;

--------------------------------------------------------------------------------------

**Comment by VQFCOSTA-Infortech** [comment]
When I try to connect to the database using Oracle's MySQL Workbench program

root@CT-SERVER-FTP# tcpdump port 3306
tcpdump: verbose output suppressed, use -v or -vv for full protocol decode
listening on eth0, link-type EN10MB (Ethernet), capture size 262144 bytes
13:39:57.902979 IP 192.168.0.227.63257 > CT-SERVER-FTP.infortech.local.mysql: Flags [P.], seq 3266936416:3266936450, ack 2736492644, win 4102, length 34
13:39:57.903011 IP 192.168.0.227.63257 > CT-SERVER-FTP.infortech.local.mysql: Flags [F.], seq 34, ack 1, win 4102, length 0
13:39:57.903117 IP CT-SERVER-FTP.infortech.local.mysql > 192.168.0.227.63257: Flags [F.], seq 1, ack 35, win 501, length 0
13:39:57.903239 IP 192.168.0.227.63256 > CT-SERVER-FTP.infortech.local.mysql: Flags [P.], seq 3859182075:3859182109, ack 2055377605, win 510, length 34
13:39:57.903260 IP 192.168.0.227.63256 > CT-SERVER-FTP.infortech.local.mysql: Flags [F.], seq 34, ack 1, win 510, length 0
13:39:57.903291 IP CT-SERVER-FTP.infortech.local.mysql > 192.168.0.227.63256: Flags [F.], seq 1, ack 35, win 501, length 0
13:39:57.903614 IP 192.168.0.227.63256 > CT-SERVER-FTP.infortech.local.mysql: Flags [.], ack 2, win 510, length 0
^C
7 packets captured
16 packets received by filter
1 packet dropped by kernel
root@CT-SERVER-FTP[]# tcpdump port 3306
tcpdump: verbose output suppressed, use -v or -vv for full protocol decode
listening on eth0, link-type EN10MB (Ethernet), capture size 262144 bytes
13:40:04.613605 IP 192.168.0.227.63924 > CT-SERVER-FTP.infortech.local.mysql: Flags [S], seq 3433325157, win 64240, options [mss 1460,nop,wscale 8,nop,nop,sackOK], length 0
13:40:04.613648 IP CT-SERVER-FTP.infortech.local.mysql > 192.168.0.227.63924: Flags [S.], seq 1596110042, ack 3433325158, win 64240, options [mss 1460,nop,nop,sackOK,nop,wscale 7], length 0
13:40:04.614801 IP 192.168.0.227.63924 > CT-SERVER-FTP.infortech.local.mysql: Flags [.], ack 1, win 513, length 0
13:40:04.615055 IP CT-SERVER-FTP.infortech.local.mysql > 192.168.0.227.63924: Flags [P.], seq 1:100, ack 1, win 502, length 99
13:40:04.615958 IP 192.168.0.227.63924 > CT-SERVER-FTP.infortech.local.mysql: Flags [P.], seq 1:37, ack 100, win 512, length 36
13:40:04.615971 IP CT-SERVER-FTP.infortech.local.mysql > 192.168.0.227.63924: Flags [.], ack 37, win 502, length 0
13:40:04.618918 IP 192.168.0.227.63924 > CT-SERVER-FTP.infortech.local.mysql: Flags [P.], seq 37:359, ack 100, win 512, length 322
13:40:04.631970 IP 192.168.0.227.63924 > CT-SERVER-FTP.infortech.local.mysql: Flags [.], ack 2155, win 513, length 0
13:40:04.635207 IP 192.168.0.227.63924 > CT-SERVER-FTP.infortech.local.mysql: Flags [P.], seq 359:497, ack 2155, win 513, length 138
13:40:04.635434 IP CT-SERVER-FTP.infortech.local.mysql > 192.168.0.227.63924: Flags [P.], seq 2155:2397, ack 497, win 501, length 242
13:40:04.642743 IP 192.168.0.227.63924 > CT-SERVER-FTP.infortech.local.mysql: Flags [P.], seq 497:826, ack 2397, win 512, length 329
13:40:04.642851 IP CT-SERVER-FTP.infortech.local.mysql > 192.168.0.227.63924: Flags [P.], seq 2397:2437, ack 826, win 501, length 40
13:40:04.643347 IP 192.168.0.227.63924 > CT-SERVER-FTP.infortech.local.mysql: Flags [P.], seq 826:876, ack 2437, win 512, length 50
13:40:04.643440 IP CT-SERVER-FTP.infortech.local.mysql > 192.168.0.227.63924: Flags [P.], seq 2437:2495, ack 876, win 501, length 58
13:40:04.643929 IP 192.168.0.227.63924 > CT-SERVER-FTP.infortech.local.mysql: Flags [P.], seq 876:931, ack 2495, win 511, length 55
13:40:04.644000 IP CT-SERVER-FTP.infortech.local.mysql > 192.168.0.227.63924: Flags [P.], seq 2495:2607, ack 931, win 501, length 112
13:40:04.644573 IP 192.168.0.227.63924 > CT-SERVER-FTP.infortech.local.mysql: Flags [P.], seq 931:987, ack 2607, win 511, length 56
13:40:04.644625 IP CT-SERVER-FTP.infortech.local.mysql > 192.168.0.227.63924: Flags [P.], seq 2607:2740, ack 987, win 501, length 133
13:40:04.645142 IP 192.168.0.227.63924 > CT-SERVER-FTP.infortech.local.mysql: Flags [P.], seq 987:1035, ack 2740, win 510, length 48
13:40:04.645193 IP CT-SERVER-FTP.infortech.local.mysql > 192.168.0.227.63924: Flags [P.], seq 2740:2871, ack 1035, win 501, length 131
13:40:04.645737 IP 192.168.0.227.63924 > CT-SERVER-FTP.infortech.local.mysql: Flags [P.], seq 1035:1107, ack 2871, win 510, length 72
13:40:04.647111 IP CT-SERVER-FTP.infortech.local.mysql > 192.168.0.227.63924: Flags [P.], seq 2871:3223, ack 1107, win 501, length 352
13:40:04.647758 IP 192.168.0.227.63924 > CT-SERVER-FTP.infortech.local.mysql: Flags [P.], seq 1107:1163, ack 3223, win 509, length 56
13:40:04.647830 IP CT-SERVER-FTP.infortech.local.mysql > 192.168.0.227.63924: Flags [P.], seq 3223:3316, ack 1163, win 501, length 93
13:40:04.648508 IP 192.168.0.227.63924 > CT-SERVER-FTP.infortech.local.mysql: Flags [P.], seq 1163:1241, ack 3316, win 508, length 78
13:40:04.648637 IP CT-SERVER-FTP.infortech.local.mysql > 192.168.0.227.63924: Flags [P.], seq 3316:3792, ack 1241, win 501, length 476
13:40:04.649199 IP 192.168.0.227.63924 > CT-SERVER-FTP.infortech.local.mysql: Flags [P.], seq 1241:1294, ack 3792, win 513, length 53
13:40:04.649257 IP CT-SERVER-FTP.infortech.local.mysql > 192.168.0.227.63924: Flags [P.], seq 3792:3932, ack 1294, win 501, length 140
13:40:04.649919 IP 192.168.0.227.63924 > CT-SERVER-FTP.infortech.local.mysql: Flags [P.], seq 1294:1365, ack 3932, win 512, length 71
13:40:04.650507 IP CT-SERVER-FTP.infortech.local.mysql > 192.168.0.227.63924: Flags [P.], seq 3932:4164, ack 1365, win 501, length 232
13:40:04.651049 IP 192.168.0.227.63924 > CT-SERVER-FTP.infortech.local.mysql: Flags [P.], seq 1365:1415, ack 4164, win 511, length 50
13:40:04.651151 IP CT-SERVER-FTP.infortech.local.mysql > 192.168.0.227.63924: Flags [P.], seq 4164:4222, ack 1415, win 501, length 58
13:40:04.652259 IP 192.168.0.227.63925 > CT-SERVER-FTP.infortech.local.mysql: Flags [S], seq 2837851141, win 64240, options [mss 1460,nop,wscale 8,nop,nop,sackOK], length 0
13:40:04.652287 IP CT-SERVER-FTP.infortech.local.mysql > 192.168.0.227.63925: Flags [S.], seq 1855101207, ack 2837851142, win 64240, options [mss 1460,nop,nop,sackOK,nop,wscale 7], length 0
13:40:04.663015 IP 192.168.0.227.63925 > CT-SERVER-FTP.infortech.local.mysql: Flags [.], ack 1, win 513, length 0
13:40:04.663235 IP CT-SERVER-FTP.infortech.local.mysql > 192.168.0.227.63925: Flags [P.], seq 1:100, ack 1, win 502, length 99
13:40:04.665021 IP 192.168.0.227.63925 > CT-SERVER-FTP.infortech.local.mysql: Flags [P.], seq 1:37, ack 100, win 512, length 36
13:40:04.665036 IP CT-SERVER-FTP.infortech.local.mysql > 192.168.0.227.63925: Flags [.], ack 37, win 502, length 0
13:40:04.667740 IP 192.168.0.227.63925 > CT-SERVER-FTP.infortech.local.mysql: Flags [P.], seq 37:359, ack 100, win 512, length 322
13:40:04.667750 IP CT-SERVER-FTP.infortech.local.mysql > 192.168.0.227.63925: Flags [.], ack 359, win 501, length 0
13:40:04.668687 IP CT-SERVER-FTP.infortech.local.mysql > 192.168.0.227.63925: Flags [P.], seq 100:2155, ack 359, win 501, length 2055
13:40:04.669411 IP 192.168.0.227.63925 > CT-SERVER-FTP.infortech.local.mysql: Flags [.], ack 2155, win 513, length 0
13:40:04.672771 IP 192.168.0.227.63925 > CT-SERVER-FTP.infortech.local.mysql: Flags [P.], seq 359:497, ack 2155, win 513, length 138
13:40:04.672982 IP CT-SERVER-FTP.infortech.local.mysql > 192.168.0.227.63925: Flags [P.], seq 2155:2397, ack 497, win 501, length 242
13:40:04.676797 IP 192.168.0.227.63925 > CT-SERVER-FTP.infortech.local.mysql: Flags [P.], seq 497:826, ack 2397, win 512, length 329
13:40:04.676863 IP CT-SERVER-FTP.infortech.local.mysql > 192.168.0.227.63925: Flags [P.], seq 2397:2437, ack 826, win 501, length 40
13:40:04.677990 IP 192.168.0.227.63925 > CT-SERVER-FTP.infortech.local.mysql: Flags [P.], seq 826:876, ack 2437, win 512, length 50
13:40:04.678060 IP CT-SERVER-FTP.infortech.local.mysql > 192.168.0.227.63925: Flags [P.], seq 2437:2495, ack 876, win 501, length 58
13:40:04.678625 IP 192.168.0.227.63925 > CT-SERVER-FTP.infortech.local.mysql: Flags [P.], seq 876:931, ack 2495, win 511, length 55
13:40:04.678689 IP CT-SERVER-FTP.infortech.local.mysql > 192.168.0.227.63925: Flags [P.], seq 2495:2607, ack 931, win 501, length 112
13:40:04.679212 IP 192.168.0.227.63925 > CT-SERVER-FTP.infortech.local.mysql: Flags [P.], seq 931:987, ack 2607, win 511, length 56
13:40:04.679264 IP CT-SERVER-FTP.infortech.local.mysql > 192.168.0.227.63925: Flags [P.], seq 2607:2740, ack 987, win 501, length 133
13:40:04.683007 IP 192.168.0.227.63925 > CT-SERVER-FTP.infortech.local.mysql: Flags [P.], seq 987:1035, ack 2740, win 510, length 48
13:40:04.683056 IP CT-SERVER-FTP.infortech.local.mysql > 192.168.0.227.63925: Flags [P.], seq 2740:2871, ack 1035, win 501, length 131
13:40:04.684901 IP 192.168.0.227.63925 > CT-SERVER-FTP.infortech.local.mysql: Flags [P.], seq 1035:1091, ack 2871, win 510, length 56
13:40:04.684952 IP CT-SERVER-FTP.infortech.local.mysql > 192.168.0.227.63925: Flags [P.], seq 2871:2911, ack 1091, win 501, length 40
13:40:04.685455 IP 192.168.0.227.63925 > CT-SERVER-FTP.infortech.local.mysql: Flags [P.], seq 1091:1147, ack 2911, win 510, length 56
13:40:04.685514 IP CT-SERVER-FTP.infortech.local.mysql > 192.168.0.227.63925: Flags [P.], seq 2911:3004, ack 1147, win 501, length 93
13:40:04.686249 IP 192.168.0.227.63925 > CT-SERVER-FTP.infortech.local.mysql: Flags [P.], seq 1147:1225, ack 3004, win 509, length 78
13:40:04.686399 IP CT-SERVER-FTP.infortech.local.mysql > 192.168.0.227.63925: Flags [P.], seq 3004:3480, ack 1225, win 501, length 476
13:40:04.687107 IP 192.168.0.227.63925 > CT-SERVER-FTP.infortech.local.mysql: Flags [P.], seq 1225:1278, ack 3480, win 508, length 53
13:40:04.687164 IP CT-SERVER-FTP.infortech.local.mysql > 192.168.0.227.63925: Flags [P.], seq 3480:3620, ack 1278, win 501, length 140
13:40:04.687938 IP 192.168.0.227.63925 > CT-SERVER-FTP.infortech.local.mysql: Flags [P.], seq 1278:1349, ack 3620, win 513, length 71
13:40:04.688797 IP CT-SERVER-FTP.infortech.local.mysql > 192.168.0.227.63925: Flags [P.], seq 3620:3852, ack 1349, win 501, length 232
13:40:04.689496 IP 192.168.0.227.63925 > CT-SERVER-FTP.infortech.local.mysql: Flags [P.], seq 1349:1399, ack 3852, win 512, length 50
13:40:04.689556 IP CT-SERVER-FTP.infortech.local.mysql > 192.168.0.227.63925: Flags [P.], seq 3852:3910, ack 1399, win 501, length 58
13:40:04.693867 IP 192.168.0.227.63924 > CT-SERVER-FTP.infortech.local.mysql: Flags [.], ack 4222, win 511, length 0
13:40:04.694355 IP 192.168.0.227.63925 > CT-SERVER-FTP.infortech.local.mysql: Flags [P.], seq 1399:1471, ack 3910, win 512, length 72
13:40:04.695390 IP CT-SERVER-FTP.infortech.local.mysql > 192.168.0.227.63925: Flags [P.], seq 3910:4262, ack 1471, win 501, length 352
13:40:04.703467 IP 192.168.0.227.63925 > CT-SERVER-FTP.infortech.local.mysql: Flags [P.], seq 1471:1550, ack 4262, win 510, length 79
13:40:04.704300 IP CT-SERVER-FTP.infortech.local.mysql > 192.168.0.227.63925: Flags [P.], seq 4262:4492, ack 1550, win 501, length 230
13:40:04.711451 IP 192.168.0.227.63925 > CT-SERVER-FTP.infortech.local.mysql: Flags [P.], seq 1550:1621, ack 4492, win 509, length 71
13:40:04.712396 IP CT-SERVER-FTP.infortech.local.mysql > 192.168.0.227.63925: Flags [P.], seq 4492:4733, ack 1621, win 501, length 241
13:40:04.713639 IP 192.168.0.227.63925 > CT-SERVER-FTP.infortech.local.mysql: Flags [P.], seq 1621:1676, ack 4733, win 508, length 55
13:40:04.713706 IP CT-SERVER-FTP.infortech.local.mysql > 192.168.0.227.63925: Flags [P.], seq 4733:4845, ack 1676, win 501, length 112
13:40:04.733626 IP 192.168.0.227.63925 > CT-SERVER-FTP.infortech.local.mysql: Flags [P.], seq 1676:1762, ack 4845, win 508, length 86
13:40:04.734806 IP CT-SERVER-FTP.infortech.local.mysql > 192.168.0.227.63925: Flags [P.], seq 4845:5075, ack 1762, win 501, length 230
13:40:04.786333 IP 192.168.0.227.63925 > CT-SERVER-FTP.infortech.local.mysql: Flags [.], ack 5075, win 507, length 0
13:40:05.108505 IP 192.168.0.227.63924 > CT-SERVER-FTP.infortech.local.mysql: Flags [P.], seq 1415:1449, ack 4222, win 511, length 34
13:40:05.108596 IP CT-SERVER-FTP.infortech.local.mysql > 192.168.0.227.63924: Flags [P.], seq 4222:4262, ack 1449, win 501, length 40
13:40:05.109077 IP 192.168.0.227.63925 > CT-SERVER-FTP.infortech.local.mysql: Flags [P.], seq 1762:1808, ack 5075, win 507, length 46
13:40:05.109091 IP 192.168.0.227.63924 > CT-SERVER-FTP.infortech.local.mysql: Flags [P.], seq 1449:1497, ack 4262, win 511, length 48
13:40:05.109285 IP CT-SERVER-FTP.infortech.local.mysql > 192.168.0.227.63925: Flags [P.], seq 5075:6124, ack 1808, win 501, length 1049
13:40:05.109377 IP CT-SERVER-FTP.infortech.local.mysql > 192.168.0.227.63924: Flags [P.], seq 4262:4423, ack 1497, win 501, length 161
13:40:05.109838 IP 192.168.0.227.63925 > CT-SERVER-FTP.infortech.local.mysql: Flags [P.], seq 1808:1854, ack 6124, win 513, length 46
13:40:05.109976 IP CT-SERVER-FTP.infortech.local.mysql > 192.168.0.227.63925: Flags [P.], seq 6124:8542, ack 1854, win 501, length 2418
13:40:05.110548 IP 192.168.0.227.63925 > CT-SERVER-FTP.infortech.local.mysql: Flags [.], ack 8542, win 513, length 0
13:40:05.110748 IP 192.168.0.227.63925 > CT-SERVER-FTP.infortech.local.mysql: Flags [P.], seq 1854:1902, ack 8542, win 513, length 48
13:40:05.111189 IP CT-SERVER-FTP.infortech.local.mysql > 192.168.0.227.63925: Flags [P.], seq 8542:11462, ack 1902, win 501, length 2920
13:40:05.111200 IP CT-SERVER-FTP.infortech.local.mysql > 192.168.0.227.63925: Flags [P.], seq 11462:14382, ack 1902, win 501, length 2920
13:40:05.111206 IP CT-SERVER-FTP.infortech.local.mysql > 192.168.0.227.63925: Flags [P.], seq 14382:17302, ack 1902, win 501, length 2920
13:40:05.111257 IP CT-SERVER-FTP.infortech.local.mysql > 192.168.0.227.63925: Flags [P.], seq 17302:17448, ack 1902, win 501, length 146
13:40:05.115733 IP 192.168.0.227.63925 > CT-SERVER-FTP.infortech.local.mysql: Flags [.], ack 17302, win 513, length 0
13:40:05.116319 IP 192.168.0.227.63925 > CT-SERVER-FTP.infortech.local.mysql: Flags [P.], seq 1902:1950, ack 17448, win 512, length 48
13:40:05.117626 IP CT-SERVER-FTP.infortech.local.mysql > 192.168.0.227.63925: Flags [P.], seq 17448:21828, ack 1950, win 501, length 4380
13:40:05.117639 IP CT-SERVER-FTP.infortech.local.mysql > 192.168.0.227.63925: Flags [P.], seq 21828:26208, ack 1950, win 501, length 4380
13:40:05.117645 IP CT-SERVER-FTP.infortech.local.mysql > 192.168.0.227.63925: Flags [P.], seq 26208:30588, ack 1950, win 501, length 4380
13:40:05.117697 IP CT-SERVER-FTP.infortech.local.mysql > 192.168.0.227.63925: Flags [P.], seq 30588:34968, ack 1950, win 501, length 4380
13:40:05.117700 IP CT-SERVER-FTP.infortech.local.mysql > 192.168.0.227.63925: Flags [P.], seq 34968:35024, ack 1950, win 501, length 56
13:40:05.118356 IP 192.168.0.227.63925 > CT-SERVER-FTP.infortech.local.mysql: Flags [.], ack 20368, win 513, length 0
13:40:05.118610 IP 192.168.0.227.63925 > CT-SERVER-FTP.infortech.local.mysql: Flags [.], ack 23288, win 513, length 0
13:40:05.119139 IP 192.168.0.227.63925 > CT-SERVER-FTP.infortech.local.mysql: Flags [.], ack 29128, win 513, length 0
13:40:05.119737 IP 192.168.0.227.63925 > CT-SERVER-FTP.infortech.local.mysql: Flags [.], ack 35024, win 513, length 0
13:40:05.120915 IP 192.168.0.227.63925 > CT-SERVER-FTP.infortech.local.mysql: Flags [P.], seq 1950:2032, ack 35024, win 513, length 82
13:40:05.121747 IP CT-SERVER-FTP.infortech.local.mysql > 192.168.0.227.63925: Flags [P.], seq 35024:35254, ack 2032, win 501, length 230
13:40:05.122373 IP 192.168.0.227.63925 > CT-SERVER-FTP.infortech.local.mysql: Flags [P.], seq 2032:2108, ack 35254, win 512, length 76
13:40:05.123200 IP CT-SERVER-FTP.infortech.local.mysql > 192.168.0.227.63925: Flags [P.], seq 35254:35476, ack 2108, win 501, length 222
13:40:05.131089 IP 192.168.0.227.63925 > CT-SERVER-FTP.infortech.local.mysql: Flags [P.], seq 2108:2184, ack 35476, win 511, length 76
13:40:05.131949 IP CT-SERVER-FTP.infortech.local.mysql > 192.168.0.227.63925: Flags [P.], seq 35476:35700, ack 2184, win 501, length 224
13:40:05.132576 IP 192.168.0.227.63925 > CT-SERVER-FTP.infortech.local.mysql: Flags [P.], seq 2184:2267, ack 35700, win 510, length 83
13:40:05.133389 IP CT-SERVER-FTP.infortech.local.mysql > 192.168.0.227.63925: Flags [P.], seq 35700:35931, ack 2267, win 501, length 231
13:40:05.162839 IP 192.168.0.227.63924 > CT-SERVER-FTP.infortech.local.mysql: Flags [.], ack 4423, win 510, length 0
13:40:05.177829 IP 192.168.0.227.63925 > CT-SERVER-FTP.infortech.local.mysql: Flags [.], ack 35931, win 509, length 0
^C
113 packets captured
115 packets received by filter
2 packets dropped by kernel

-----------------------
-----------------------

When I try to connect to the bank using mRemoteNG

-----------------------

root@CT-SERVER-FTP[]# tcpdump port 3306
tcpdump: verbose output suppressed, use -v or -vv for full protocol decode
listening on eth0, link-type EN10MB (Ethernet), capture size 262144 bytes
^C
0 packets captured
3 packets received by filter
0 packets dropped by kernel
1 packet dropped by interface
root@CT-SERVER-FTP[]#

**Comment by VQFCOSTA-Infortech** [comment]
![image](https://github.com/mRemoteNG/mRemoteNG/assets/140181514/4a9468e5-11b9-492c-a92c-e5dac6e0643a)

**Comment by VQFCOSTA-Infortech** [comment]
What would this need 2 check be?
Is there anyone who can help me?
Or any support email I can call?

**Comment by JeanPluzo** [comment]
Hi,
are you trying to connect directly to a MySQL DB with mRemoteNG?
I don't think this program supports that.

Regards,
J.

**Comment by Kvarkas** [comment]
> What would this need 2 check be? Is there anyone who can help me? Or any support email I can call?

I receive you support request but unfortunately a bit suppresed on time at the moment so could not help imideatly, but we have a look. As far as i remember we support only mssql, but its not a big difference so perhaps i will add suport to mysql as well next. 

it may requred to add odbc connection to maria...

**Comment by VQFCOSTA-Infortech** [comment]
![image](https://github.com/mRemoteNG/mRemoteNG/assets/140181514/e47fde99-271e-4169-9558-7faa227f19a4)

https://mremoteng.readthedocs.io/en/latest/sql_configuration.html

It turns out that mRemoteNG doesn't even try to connect to the server, no packets arrive on my server

**Comment by Kvarkas** [comment]
it could be a schema dont match, we have fix for mssql not for mysql, will try to look over this week

**Comment by VQFCOSTA-Infortech** [comment]
Thank you very much!
I await news...

**Comment by VQFCOSTA-Infortech** [comment]
news?

**Comment by VQFCOSTA-Infortech** [comment]
News??

**Comment by Kvarkas** [comment]
be patient, I am not a reactive, one item per time, dealing with other issues at the moment.

**Comment by VQFCOSTA-Infortech** [comment]
Ok, sorry, as I said I would check in the week, I was looking forward to the solution that week, since compatibility is also informed in the system description.
I will wait for your return, see you later.

**Comment by VQFCOSTA-Infortech** [comment]
News??

**Comment by Kvarkas** [comment]
Good news! I am back from holidays! :D

**Comment by VQFCOSTA-Infortech** [comment]
That's good kkkk, I'm waiting for news about the update to work with MySQL with Linux, but I hope you've rested on vacation.

**Comment by VQFCOSTA-Infortech** [comment]
News?

**Comment by VQFCOSTA-Infortech** [comment]
News?

**Comment by VQFCOSTA-Infortech** [comment]
Good morning!
I am insisting on this demand only because it was placed in the system support that is compatible with mysql, so I am demanding this compatibility.
If this is not possible, if you are not interested in maintaining this compatibility, just let me know so that I can stop building the database in MySQL, because you do not provide any updates and it has been months since the service was opened.
I would really like to use mysql, especially for the simplicity of installing it, since maintaining a sql server on windows is more work than with linux.

**Comment by JeanPluzo** [comment]
Hi,
I think your concern in your last post is related to #2474 
Regards,
J.

**Comment by VQFCOSTA-Infortech** [comment]
Actually, I had installed the stable version and only the testing version had access to the mysql database, I upgraded to testing, communicated with the database, but I cannot import the xml file that I currently use into the database, When trying to import both csv and xml, the import gives an error.

The Database was assembled according to the how to below
https://web.archive.org/web/20220709193121/https://mremoteng.readthedocs.io/en/latest/sql_configuration.html

**Comment by VQFCOSTA-Infortech** [comment]
They should update the help below to the testing version too

https://mremoteng.readthedocs.io/en/v1.77.3-dev/

**Comment by VQFCOSTA-Infortech** [comment]
![image](https://github.com/mRemoteNG/mRemoteNG/assets/140181514/b203b53e-2f06-4c57-a26a-6ccd9d0bb718)

In addition to these errors when creating folders and connections

**Comment by VQFCOSTA-Infortech** [comment]
@Kvarkas @JeanPluzo Alguma novidade?

**Comment by JeanPluzo** [comment]
@VQFCOSTA-Infortech: by the (very) slow response from the developer, I would not use this program (mRemoteNG) anymore, since, like you have seen, there are promises which are not kept.
Use another solution to solve your problems for the time being.

Regards,
J.

**Comment by Kvarkas** [comment]
Hello, I am back (that 2fa realy nithtmare to restore if loose you phone) will have this in my diary on line number 1

**Comment by Kvarkas** [comment]
> @Kvarkas @JeanPluzo Alguma novidade?

English or Lietuviškai arba по Русски

**Comment by VQFCOSTA-Infortech** [comment]
Any news?

**Comment by VQFCOSTA-Infortech** [comment]
Problem communicating with the MySQL database resolved.

https://github.com/mRemoteNG/mRemoteNG/issues/2500#issuecomment-1769126892

mRemoteNG version used
https://github.com/mRemoteNG/mRemoteNG/releases/download/v1.77.1/mRemoteNG-Portable-1.77.1.27713.zip

Database Script
https://github.com/mRemoteNG/mRemoteNG/blob/v1.77.1/mRemoteV1/Documentation/mysql_db_setup.sql

**Comment by A1xander** [comment]
When importing or creating a folder, the following error appears. That is, connections can be made, but without folders, and this is very inconvenient
![image](https://github.com/mRemoteNG/mRemoteNG/assets/47692107/c4bf71c9-daa4-4805-93ed-375578ba1720)
